{
    "$schema": "http://json-schema.org/draft-07/schema#", 
    "type": "object",
    "properties": {
        "name": {
            "type": "string"
        },
        "id": {
            "type": "string"
        },
        "description": {
            "type": "string"
        },
        "image": {
            "type": "string"
        },
        "svg": {
            "type": "string"
        },
        "full": {
            "type": "string",
            "description": "Full image with background"
        },
        "dead":{
            "type": "string",
            "description": "Dead tree"
        },
        "full_dead": {
            "type": "string"
        },
        "stages": {
            "type": "array",
            "items": {
                "type": "object",
                "properties": {
                    "id": {
                        "type": "string"
                    },
                    "sequence": {
                        "type": "number"
                    },
                    "name": {
                        "type": "string"
                    },
                    "image": {
                        "type": "string"
                    },
                    "droplets": {
                        "type": "number"
                    },
                    "streak": {
                        "type": "number"
                    },
                    "svg": {
                        "type": "string"
                    }, 
                    "description": {
                        "type": "string"
                    },
                    "full": {
                        "type": "string",
                        "description": "Full image with background"
                    },
                    "animation_lottie": {"type": "string"},
                    "dead": {
                        "type": "string"
                    },
                    "full_dead": {
                        "type": "string"
                    }
                },
                "required": ["sequence", "name", "image", "id", "description", "full", "animation_lottie", "dead", "full_dead"]
            }
        },
        "animation_lottie": {"type": "string"}
    },
    "required": ["name", "id", "description", "image", "svg", "full", "stages", "animation_lottie", "dead", "full_dead"]
}