{
    "name": "Guadalupe Palm",
    "description": "Native to hidden shores, this palm thrives under sun and salt. It\u2019s said to bring prosperity when planted near a dwelling.",
    "image": "mature.png",
    "svg": "mature.svg",
    "id": "guadalupe-palm",
    "full": "mature-full.jpg",
    "stages": [
        {
            "id": "seed",
            "name": "Seed",
            "image": "seed.png",
            "svg": "seed.svg",
            "droplets": 0,
            "sequence": 0,
            "streak": 0,
            "full": "seed-full.jpg",
            "description": "Buried beneath the surface, the seed hums with quiet energy. It holds the entire blueprint of the tree's future\u2014waiting for light, water, and purpose.",
            "animation_lottie": "seed.lottie",
            "dead": "seed-dead.png",
            "full_dead": "seed-dead-full.png"
        },
        {
            "id": "planted",
            "name": "Planted",
            "image": "seed.png",
            "svg": "seed.svg",
            "droplets": 0,
            "sequence": 1,
            "streak": 0,
            "full": "planted-full.jpg",
            "description": "The seed has been placed with care. Now cradled by earth and nourished by intention, its journey begins\u2014still unseen, but already becoming.",
            "animation_lottie": "seed.lottie",
            "dead": "planted-dead.png",
            "full_dead": "planted-dead-full.png"
        },
        {
            "id": "sprout",
            "name": "Sprout",
            "image": "sprout.png",
            "svg": "sprout.svg",
            "droplets": 15000,
            "sequence": 2,
            "streak": 15,
            "description": "A fragile shoot pierces the soil, reaching for the sky. It's a sign of life, of hope\u2014delicate but determined.",
            "full": "sprout-full.jpg",
            "animation_lottie": "sprout.lottie",
            "dead": "sprout-dead.png",
            "full_dead": "sprout-dead-full.png"
        },
        {
            "id": "sapling",
            "name": "Sapling",
            "image": "sapling.png",
            "svg": "sapling.svg",
            "droplets": 20000,
            "sequence": 3,
            "streak": 20,
            "description": "The trunk strengthens and leaves multiply. No longer just a sprout, the sapling starts to resemble the tree it's destined to become.",
            "full": "sapling-full.jpg",
            "animation_lottie": "sapling.lottie",
            "dead": "sapling-dead.png",
            "full_dead": "sapling-dead-full.png"
        },
        {
            "id": "young-tree",
            "name": "Young Tree",
            "image": "young-tree.png",
            "svg": "young-tree.svg",
            "droplets": 30000,
            "sequence": 4,
            "streak": 30,
            "description": "Branches stretch, bark thickens, roots deepen. The tree now claims its space, shaped by wind, sun, and time.",
            "full": "young-tree-full.jpg",
            "animation_lottie": "young-tree.lottie",
            "dead": "young-tree-dead.png",
            "full_dead": "young-tree-dead-full.png"
        },
        {
            "id": "mature",
            "name": "Mature",
            "image": "mature.png",
            "svg": "mature.svg",
            "droplets": 100000,
            "sequence": 5,
            "streak": 60,
            "description": "The tree stands tall\u2014resilient, proud, and fully formed. It may now bear fruit, offer shelter, or whisper ancient secrets to those who listen.",
            "full": "mature-full.jpg",
            "animation_lottie": "mature.lottie",
            "dead": "mature-dead.png",
            "full_dead": "mature-dead-full.png"
        },
        {
            "id": "mystic",
            "name": "Mystic",
            "image": "mature.png",
            "svg": "mature.svg",
            "droplets": 100000,
            "sequence": 6,
            "streak": 180,
            "description": "The tree stands tall—resilient, proud, and fully formed. It may now bear fruit, offer shelter, or whisper ancient secrets to those who listen.",
            "full": "mature-full.jpg",
            "animation_lottie": "mature.lottie",
            "dead": "mature-dead.png",
            "full_dead": "mature-dead-full.png"
        }
    ],
    "animation_lottie": "mature.lottie",
    "dead": "mature-dead.png",
    "full_dead": "mature-dead-full.png"
}